{
  "$schema": "https://json-schema.org/draft/2020-12/schema",
  "$id": "https://schemas.rexo.dev/v0.1/workflow.schema.json",
  "title": "REXO Workflow Definition",
  "type": "object",
  "additionalProperties": false,
  "required": ["schema_version", "id", "version", "steps"],
  "properties": {
    "schema_version": {
      "const": "0.1.0"
    },
    "id": {
      "type": "string",
      "pattern": "^[a-z][a-z0-9-]*$"
    },
    "version": {
      "type": "string",
      "pattern": "^[0-9]+\\.[0-9]+\\.[0-9]+(?:-[0-9A-Za-z.-]+)?$"
    },
    "steps": {
      "type": "array",
      "minItems": 1,
      "items": {
        "type": "object",
        "additionalProperties": false,
        "required": ["id", "capability", "needs"],
        "properties": {
          "id": {
            "type": "string",
            "pattern": "^[a-z][a-z0-9-]*$"
          },
          "capability": {
            "type": "string",
            "pattern": "^[a-z][a-z0-9]*(?:\\.[a-z][a-z0-9]*)+$"
          },
          "needs": {
            "type": "array",
            "items": {
              "type": "string",
              "pattern": "^[a-z][a-z0-9-]*$"
            },
            "uniqueItems": true
          },
          "with": {
            "type": "object",
            "description": "Capability inputs. A value is either a literal, or a reference { \"from_task\": \"<step-id>\" } that injects the output of an upstream step listed in needs.",
            "additionalProperties": true
          },
          "max_attempts": {
            "type": "integer",
            "minimum": 1,
            "maximum": 10,
            "default": 3
          }
        }
      }
    },
    "outputs": {
      "type": "object",
      "description": "Optional map of output file path (relative to the project) to the step id whose output is written there after a successful run.",
      "additionalProperties": {
        "type": "string",
        "pattern": "^[a-z][a-z0-9-]*$"
      }
    }
  }
}
